Poem_Index,Title,Author,URL,Content,A,B,C,Translation
137,玉台体,权德舆 〔唐代〕,https://www.gushiwen.cn/shiwenv_26e5d8ef07d7.aspx,"昨夜裙带解，今朝蟢子飞。
铅华不可弃，莫是藁砧归。",送魏万之京,玉阶怨,章台夜思,昨晚我裙带忽然松弛解开，早晨又看见蟢子双双飞来。要赶紧描眉擦粉梳妆打扮，莫非是我的丈夫快要回来。
138,独不见,沈佺期 〔唐代〕,https://www.gushiwen.cn/shiwenv_f46d7bbf66b8.aspx,"卢家少妇郁金堂，海燕双栖玳瑁梁。
九月寒砧催木叶，十年征戍忆辽阳。
白狼河北音书断，丹凤城南秋夜长。
谁为含愁独不见，更教明月照流黄。",宿府,喜见外弟又言别,月下独酌·其一,卢家年轻的主妇，居住在以郁金浸洒和泥涂壁的华美的屋宇之内，海燕飞来，成对成双地栖息于华丽的屋梁之上。九月里，寒风过后，在急切的捣衣声中，树叶纷纷下落，丈夫远征辽阳已逾十载，令人思念。白狼河北的辽阳地区音信全部被阻断，幽居在长安城南的少妇感到秋日里的夜晚特别漫长。是谁使人满怀愁绪难见亲人，偏偏还让那月光空照帷帐。
139,燕歌行·并序,高适 〔唐代〕,https://www.gushiwen.cn/shiwenv_4c7868ec4409.aspx,"开元二十六年，客有从元戎出塞而还者，作《燕歌行》以示，适感征戍之事，因而和焉。
汉家烟尘在东北，汉将辞家破残贼。
男儿本自重横行，天子非常赐颜色。
摐金伐鼓下榆关，旌旆逶迤碣石间。
校尉羽书飞瀚海，单于猎火照狼山。
山川萧条极边土，胡骑凭陵杂风雨。
战士军前半死生，美人帐下犹歌舞。
大漠穷秋塞草腓，孤城落日斗兵稀。
身当恩遇常轻敌，力尽关山未解围。(常轻敌 一作：恒轻敌)
铁衣远戍辛勤久，玉箸应啼别离后。
少妇城南欲断肠，征人蓟北空回首。
边庭飘飖那可度，绝域苍茫无所有。(飘飖 一作：飘摇；无所 一作：更何)
杀气三时作阵云，寒声一夜传刁斗。
相看白刃血纷纷，死节从来岂顾勋！(血 一作：雪)
君不见沙场征战苦，至今犹忆李将军。",长恨歌,行路难·其一,白雪歌送武判官归京,"唐玄宗开元二十六年，有个随从主帅出塞回来的人，写了一首《燕歌行》给我看。我感慨于边疆戍守的事，因而写了这首《燕歌行》应和他。
汉朝东北边境战事又起，将军离家前去征讨贼寇。

男儿本来就看重驰骋沙场，杀敌打仗，皇帝又特别给予他们丰厚的赏赐。
擂响金鼓，军队浩浩荡荡开出山海关外，旌旗舒展飘扬在碣石山间。
校尉飞奔过浩瀚沙海，紧急传递文书，匈奴单于打猎时点燃的火光已照到我狼山。
山河荒芜多萧条，满目凄凉到边土，胡人的骑兵来势凶猛，如风雨交加。
战士在前线杀得昏天黑地，不辨死生；将军们依然逍遥自在地在营帐中观赏美人的歌舞！
深秋季节，塞外沙漠上草木枯萎；日落时分，边城孤危，作战的士兵越打越少。
身受朝廷恩宠厚遇的主将常常轻视敌人，战士筋疲力尽仍难解关山之围。
身披铁甲的征夫，不知道守卫边疆多少年了，那家中的思妇自丈夫被征走后，应该一直在悲痛啼哭吧。
思妇独守故乡，悲苦地牵肠挂肚，征夫在边疆遥望家园空自回头。
边塞战场动荡不安哪里能够轻易归来，更遥远的边陲更加荒凉不毛。
从早到晚杀气腾腾战云密布，整夜里只听到巡更的刁斗声声悲伤。
战士们互相对望，雪亮的战刀上染满了斑斑血迹；坚守节操，为国捐躯，岂是为了个人的名利功勋？
你没看见拼杀在沙场战斗多惨苦，现在还在思念有勇有谋的李将军。"
140,烈女操,孟郊 〔唐代〕,https://www.gushiwen.cn/shiwenv_5a67990459e3.aspx,"梧桐相待老，鸳鸯会双死。
贞女贵殉夫，舍生亦如此。
波澜誓不起，妾心古井水。(古井水 一作：井中水)",登金陵凤凰台,贫女,送杨氏女,雄梧雌桐枝叶覆盖相守终老，鸳鸯水鸟成双成对至死相随。贞洁的妇女贵在为丈夫殉节，为此舍生才称得上至善至美。对天发誓我心永远忠贞不渝，就像清净不起波澜的古井水！
141,灞上秋居,马戴 〔唐代〕,https://www.gushiwen.cn/shiwenv_5d0d8b3c1111.aspx,"灞原风雨定，晚见雁行频。
落叶他乡树，寒灯独夜人。
空园白露滴，孤壁野僧邻。
寄卧郊扉久，何年致此身。",喜外弟卢纶见宿,山居秋暝,溪居,灞原上的秋风细雨初定，傍晚看见雁群南去不停。面对他乡树木落叶纷纷，寒夜的孤灯独照我一人。空园里白露频频地下滴，单门独户只与野僧为邻。寄卧荒凉郊居为时已久，何时才能为国致力献身？
142,滁州西涧,韦应物 〔唐代〕,https://www.gushiwen.cn/shiwenv_f6bd6356c843.aspx,"独怜幽草涧边生，上有黄鹂深树鸣。
春潮带雨晚来急，野渡无人舟自横。",山居秋暝,西施咏,利州南渡,唯独喜欢涧边幽谷里生长的野草，还有那树丛深处婉转啼鸣的黄鹂。傍晚时分，春潮上涨，春雨淅沥，西涧水势顿见湍急，荒野渡口无人，只有一只小船悠闲地横在水面。
143,溪居,柳宗元 〔唐代〕,https://www.gushiwen.cn/shiwenv_324652b6ac3d.aspx,"久为簪组累，幸此南夷谪。(累 一作：束)
闲依农圃邻，偶似山林客。
晓耕翻露草，夜榜响溪石。
来往不逢人，长歌楚天碧。",寄全椒山中道士,桃花溪,寻南溪常山道人隐居,长久被官职束缚不得自由，幸好被贬谪到边远的永州一带。闲静无事，与农人的菜圃为邻，有的时候就像个山间隐士。早晨耕田，翻锄带着露水的野草，傍晚伴着水激溪石的声响归去。来去之间碰不到那庸俗之辈，眼望楚天一片碧绿，高歌自娱。
144,游子吟,孟郊 〔唐代〕,https://www.gushiwen.cn/shiwenv_161d06b0b556.aspx,"慈母手中线，游子身上衣。
临行密密缝，意恐迟迟归。
谁言寸草心，报得三春晖。",落花,梦游天姥吟留别,长恨歌,慈祥的母亲手里把着针线，为即将远游的孩子赶制新衣。临行前一针针密密地缝缀，担心孩子回来得晚衣服破损。谁说像小草那样微弱的孝心，能报答得了像春晖普泽的慈母恩情呢？
145,渭川田家,王维 〔唐代〕,https://www.gushiwen.cn/shiwenv_8813f91342c8.aspx,"斜阳照墟落，穷巷牛羊归。(斜阳 一作：斜光)
野老念牧童，倚杖候荆扉。
雉雊麦苗秀，蚕眠桑叶稀。
田夫荷锄至，相见语依依。(至 一作：立)
即此羡闲逸，怅然吟式微。",送灵澈上人,送綦毋潜落第还乡,阁夜,夕阳的余晖洒向村庄，牛羊沿着深巷纷纷回归。村中老人惦念着放牧的孙儿，倚着拐杖在柴门边等候。野鸡鸣叫，麦子秀穗，蚕像睡觉了一样，桑叶也变得稀少。农夫们三三两两扛着锄头归来，在田间小道上偶然相遇，亲切絮语，乐而忘归。在这种时刻如此闲情逸致怎不叫我羡慕？我不禁怅然地吟起《式微》。
146,渡荆门送别,李白 〔唐代〕,https://www.gushiwen.cn/shiwenv_d50eb19399e6.aspx,"渡远荆门外，来从楚国游。
山随平野尽，江入大荒流。
月下飞天镜，云生结海楼。
仍怜故乡水，万里送行舟。",次北固山下,送僧归日本,登柳州城楼寄漳汀封连四州,我乘舟渡江来到遥远的荆门外，来到战国时期楚国的境内游览。高山随着平坦广阔的原野的出现而逐渐消失，江水在广阔无际的田野中奔流。月亮在水中的倒影好像天上飞下来的一面天镜，云彩升起，变幻无穷，结成了海市蜃楼。我依然喜爱这来自故乡之水，不远万里来送我东行的小舟。
147,渡汉江,宋之问 〔唐代〕,https://www.gushiwen.cn/shiwenv_4f7e2f94ec4a.aspx,"岭外音书断，经冬复历春。
近乡情更怯，不敢问来人。",金谷园,江雪,哀江头,客居岭外与家里音信断绝，经过了冬天又到了春天。离故乡越近心中越胆怯，不敢询问从家那边过来的人。
148,渔翁,柳宗元 〔唐代〕,https://www.gushiwen.cn/shiwenv_3aba195e605d.aspx,"渔翁夜傍西岩宿，晓汲清湘燃楚竹。
烟销日出不见人，欸乃一声山水绿。
回看天际下中流，岩上无心云相逐。",终南山,桃源行,晨诣超师院读禅经,渔翁晚上停船靠着西山歇宿，早上汲取清澈的湘水，以楚竹为柴做饭。旭日初升，云雾散尽四周悄然无声，渔翁摇橹的声音从碧绿的山水中传出。回身一看，他已驾舟行至天际中流，山岩顶上，只有无心白云相互追逐。
149,清明日宴梅道士房,孟浩然 〔唐代〕,https://www.gushiwen.cn/shiwenv_4041576ad0f3.aspx,"林卧愁春尽，搴帷览物华。
忽逢青鸟使，邀入赤松家。
金灶初开火，仙桃正发花。
童颜若可驻，何惜醉流霞。",长恨歌,寄全椒山中道士,九日登望仙台呈刘明府,静卧在林中为春天即将远去而忧愁，揭开帐子欣赏山中的自然美景。忽然梅道士派人送来书信，邀我去他那里赴宴。房里炼丹炉刚刚点起火，屋外桃花正灼灼盛开。如果说饮此酒能永葆青春，那我一定一醉方休。
150,清平调·其二,李白 〔唐代〕,https://www.gushiwen.cn/shiwenv_4b5845ac138d.aspx,"一枝秾艳露凝香，云雨巫山枉断肠。(秾艳 一作：红艳)
借问汉宫谁得似，可怜飞燕倚新妆。",遣怀,长相思·其二,行路难·其二,贵妃真是一枝带露牡丹，艳丽凝香，楚王神女巫山相会，枉然悲伤断肠。请问汉宫得宠妃嫔，谁能和她相像？可爱无比的赵飞燕，还得依仗新妆！
151,清平调·其三,李白 〔唐代〕,https://www.gushiwen.cn/shiwenv_29165f23cefd.aspx,"名花倾国两相欢，长得君王带笑看。(长得 一作：常得)
解释春风无限恨，沉香亭北倚阑干。",为有,行路难·其三,赠阙下裴舍人,绝代佳人与红艳牡丹相得益彰，常常使得君王满面笑容不停观看。在沉香亭北共同倚靠着栏杆，动人姿色似春风能消无限春愁春恨。
152,清平调·其一,李白 〔唐代〕,https://www.gushiwen.cn/shiwenv_170df91879a2.aspx,"云想衣裳花想容，春风拂槛露华浓。
若非群玉山头见，会向瑶台月下逢。",阙题,长干行·其一,集灵台·其一,见云之灿烂就联想到她华艳的衣裳，见到花就联想到她艳丽的容貌；春风吹拂栏杆，牡丹花沾着晶莹的露珠更显得花色浓艳。如此天姿国色，不是群玉山头所见的飘飘仙子，就是瑶台殿前月光照耀下的神女。
153,淮上喜会梁州故人,韦应物 〔唐代〕,https://www.gushiwen.cn/shiwenv_43e1c0daacca.aspx,"江汉曾为客，相逢每醉还。
浮云一别后，流水十年间。
欢笑情如旧，萧疏鬓已斑。
何因不归去？淮上有秋山。",送友人,喜见外弟又言别,归嵩山作,想当年客居他乡，飘零江汉；与你异乡聚首，携手醉还。离别后如浮云飘忽不定，流水岁月，匆匆一晃就已过了十年。今日相见，欢笑融洽的情态一如从前，人已头发稀疏，两鬓斑白了。为何我不与故人同归去？因为淮上风景秀美的秋山。
154,洛阳女儿行,王维 〔唐代〕,https://www.gushiwen.cn/shiwenv_e3bfcb5ede2b.aspx,"洛阳女儿对门居，才可颜容十五余。
良人玉勒乘骢马，侍女金盘脍鲤鱼。
画阁朱楼尽相望，红桃绿柳垂檐向。
罗帷送上七香车，宝扇迎归九华帐。
狂夫富贵在青春，意气骄奢剧季伦。
自怜碧玉亲教舞，不惜珊瑚持与人。
春窗曙灭九微火，九微片片飞花琐。
戏罢曾无理曲时，妆成祗是熏香坐。
城中相识尽繁华，日夜经过赵李家。
谁怜越女颜如玉，贫贱江头自浣纱。",琵琶行,贫女,送杨氏女,"洛阳有一位女子住在我家对门，正当十五六的芳年容颜非常美丽。
她的丈夫骑一匹青白相间的骏马，马具镶嵌着珍贵的美玉。她的婢女捧上黄金的盘子，里面盛着烹制精细的鲤鱼。
她家彩绘朱漆的楼阁一幢幢遥遥相望，红桃绿柳在廊檐下排列成行。
她乘坐的车子是用七种香木做成，绫罗的帷幔装在车上。仆从们举着羽毛的扇子，把她迎回绣着九花图案的彩帐。
她的丈夫青春年少正得志，骄奢更胜过石季伦。
他亲自教授心爱的姬妾学习舞蹈，名贵的珊瑚树随随便便就送给别人。
他们彻夜寻欢作乐，窗上现出曙光才熄去灯火，灯花的碎屑片片落在雕镂的窗棱。
她成天嬉戏游玩，竟没有温习歌曲的空暇，打扮得整整齐齐，只是熏着香成天闲话。
相识的全是城中的豪门大户，日夜来往的都是些贵戚之家。
有谁怜惜貌美如玉的越女，身处贫贱，只好在江头独自洗纱。"
155,泊秦淮,杜牧 〔唐代〕,https://www.gushiwen.cn/shiwenv_8e8011f614fb.aspx,"烟笼寒水月笼沙，夜泊秦淮近酒家。
商女不知亡国恨，隔江犹唱后庭花。",隋宫·紫泉宫殿锁烟霞,枫桥夜泊,夜泊牛渚怀古,迷离月色和轻烟笼罩着寒水白沙，夜晚船只停泊在秦淮河边靠近岸上的酒家。卖唱的歌女不知道什么是亡国之恨，隔着江水仍在高唱着《玉树后庭花》。
156,没蕃故人,张籍 〔唐代〕,https://www.gushiwen.cn/shiwenv_67a8c97e4204.aspx,"前年戍月支，城下没全师。(戍 一作：伐；城下 一作：城上)
蕃汉断消息，死生长别离。
无人收废帐，归马识残旗。
欲祭疑君在，天涯哭此时。",宣州谢朓楼饯别校书叔云,客夜与故人偶集,在狱咏蝉,前年出征月支，在城下全军覆没。蕃汉之间消息已完全断绝，我与你生死两隔，长久别离。战场上无人收拾废弃的营帐，归来的战马还认识残破的军旗。想祭奠你又怀疑你还活着，此时只能朝着天边痛哭流涕。
157,江雪,柳宗元 〔唐代〕,https://www.gushiwen.cn/shiwenv_58313be2d918.aspx,"千山鸟飞绝，万径人踪灭。
孤舟蓑笠翁，独钓寒江雪。",自夏口至鹦鹉洲夕望岳阳寄源中丞,哀江头,渡汉江,所有山上飞鸟的身影已经绝迹，所有道路都不见人的踪迹。江面孤舟上，一位披戴着蓑笠的老翁，独自在漫天风雪中垂钓。
158,江州重别薛六柳八二员外,刘长卿 〔唐代〕,https://www.gushiwen.cn/shiwenv_dea6fe3c2c99.aspx,"生涯岂料承优诏，世事空知学醉歌。
江上月明胡雁过，淮南木落楚山多。
寄身且喜沧洲近，顾影无如白发何。
今日龙钟人共弃，愧君犹遣慎风波。(弃 一作：老)",早秋三首·其一,秋夜寄邱员外,八月十五夜赠张功曹,多年沦落的生涯，谁知竟得到天子的厚恩。世间万事我都已参破，只想学醉饮狂歌的古人。江上的月色分外清明，胡雁从夜空飞掠而过。秋风吹起，淮南已树木凋尽，楚地山头的落叶想必更多。且喜暂时可以寄身的地方，在那沧海近旁。对着明镜来回照影，萧萧白发徒然地令人心伤。如今你们同我都已经老去，都一样是这般步履龙钟。你们还叮嘱我要留意风波险恶，真叫我深深惭愧无限感动。
159,江南逢李龟年,杜甫 〔唐代〕,https://www.gushiwen.cn/shiwenv_514b8bc0ee4f.aspx,"岐王宅里寻常见，崔九堂前几度闻。
正是江南好风景，落花时节又逢君。",汉江临泛,江南曲,新年作,当年我经常在岐王与崔九的住宅里见到你并听到你的歌声。眼下正是江南风景最美的时候，在这落花纷飞的时节再次与你相逢。
160,江南曲,李益 〔唐代〕,https://www.gushiwen.cn/shiwenv_01536e4b8dfb.aspx,"嫁得瞿塘贾，朝朝误妾期。
早知潮有信，嫁与弄潮儿。",为有,江南逢李龟年,长干行·其一,我真悔恨嫁做瞿塘商人妇，他天天把相会的佳期耽误。早知潮水的涨落这么守信，还不如嫁一个弄潮的丈夫。
161,汉江临泛,王维 〔唐代〕,https://www.gushiwen.cn/shiwenv_d0c23694485b.aspx,"楚塞三湘接，荆门九派通。
江流天地外，山色有无中。
郡邑浮前浦，波澜动远空。
襄阳好风日，留醉与山翁。",登金陵凤凰台,江雪,哀江头,汉江流经楚塞又折入三湘，西起荆门往东与九江相通。江水滔滔远去，好像一直涌流到天地之外，两岸山色时隐时现，若有若无。远处的城郭好像在水面上飘动，波翻浪涌，辽远的天空也仿佛为之摇荡。襄阳的风景天气好，我愿在此地酣饮陪伴山翁。
162,次北固山下,王湾 〔唐代〕,https://www.gushiwen.cn/shiwenv_720b46d38537.aspx,"客路青山外，行舟绿水前。
潮平两岸阔，风正一帆悬。
海日生残夜，江春入旧年。
乡书何处达？归雁洛阳边。",渡荆门送别,晚次鄂州,饯别王十一南游,郁郁葱葱的山外是旅客的道路，船航行在绿水之间。潮水涨满，两岸与江水齐平，整个江面十分开阔，帆顺着风端直高挂。夜幕还没有褪尽，旭日已在江上冉冉升起，江上春早，旧年未过新春已来。我的家书应该送到什么地方呢？北去的归雁啊，请给我捎回洛阳那边！
163,楚江怀古三首·其一,马戴 〔唐代〕,https://www.gushiwen.cn/shiwenv_2a4d274daaf8.aspx,"露气寒光集，微阳下楚丘。
猿啼洞庭树，人在木兰舟。
广泽生明月，苍山夹乱流。
云中君不见，竟夕自悲秋。",山居秋暝,早秋三首·其一,将进酒,雾露团团凝聚寒气侵人，夕阳已经落下楚地的山丘。洞庭湖畔的树上猿啼声不断，乘着木兰舟悠闲地在湖中泛游。明月从广阔的湖面上缓缓升起，两岸青山夹着滔滔乱流。美丽的云神始终不肯降临，使我终夜苦思，独自悲秋。
164,梦游天姥吟留别,李白 〔唐代〕,https://www.gushiwen.cn/shiwenv_05e2f6fc757c.aspx,"海客谈瀛洲，烟涛微茫信难求；
越人语天姥，云霞明灭或可睹。
天姥连天向天横，势拔五岳掩赤城。
天台四万八千丈，对此欲倒东南倾。(四万 一作：一万)
我欲因之梦吴越，一夜飞度镜湖月。
湖月照我影，送我至剡溪。
谢公宿处今尚在，渌水荡漾清猿啼。
脚著谢公屐，身登青云梯。
半壁见海日，空中闻天鸡。
千岩万转路不定，迷花倚石忽已暝。
熊咆龙吟殷岩泉，栗深林兮惊层巅。
云青青兮欲雨，水澹澹兮生烟。
列缺霹雳，丘峦崩摧。
洞天石扉，訇然中开。
青冥浩荡不见底，日月照耀金银台。
霓为衣兮风为马，云之君兮纷纷而来下。
虎鼓瑟兮鸾回车，仙之人兮列如麻。
忽魂悸以魄动，恍惊起而长嗟。
惟觉时之枕席，失向来之烟霞。
世间行乐亦如此，古来万事东流水。
别君去兮何时还？且放白鹿青崖间，须行即骑访名山。
安能摧眉折腰事权贵，使我不得开心颜？",蜀道难,游子吟,长相思·其一,"听海外来客们谈起瀛洲，烟波渺茫实在难以寻求。
越中来人说起天姥山，在云雾忽明忽暗间有时能看见。
天姥山仿佛连接着天遮断了天空，山势高峻超过五岳，遮掩过赤城山。
天台山虽高四万八千丈，面对着它好像要向东南倾斜拜倒一样。
我想依据越人说的话梦游到吴越，一天夜晚飞渡过明月映照下的镜湖。
镜湖上的月光照着我的身影，一直送我到了剡溪。
谢灵运住的地方如今还在，清澈的湖水荡漾，猿猴凄清啼叫。
我脚上穿着谢公当年特制的木鞋，攀登直上云霄的山路。
上到半山腰就看见了从海上升起的太阳，空中传来天鸡报晓的啼鸣之声。
无数山岩重叠，山道曲折，盘旋变化不定。迷恋着花，依倚着石，不觉天色已晚。
熊在怒吼，龙在长鸣，岩中的泉水在震响，使深林战栗，使高耸而重叠的山峰惊颤。
云层黑沉沉的，像是要下雨，水波动荡生起了薄薄的烟雾。
电光闪闪，雷声轰鸣，山峰好像要崩塌似的。
仙府的石门，“訇”的一声从中间打开。
洞中蔚蓝的天空广阔无际，看不到尽头，日月照耀着金银做的宫阙。
用彩虹做衣裳，将风作为马来乘，云中的神仙们纷纷下来。
老虎弹奏着琴瑟，鸾鸟驾着车。仙人们排成列，密密麻麻。
忽然魂魄惊动，我猛然惊醒，不禁长声叹息。
醒来时只有身边的枕席，刚才梦中所见的烟雾云霞全都消失了。
人世间的欢乐也是像梦中的幻境这样，自古以来万事都像东流的水一样一去不复返。
告别诸君，此番远去不知何时才能回来？暂且把白鹿放牧在青崖间，等到要远行时就骑上它寻访名山。
岂能卑躬屈膝去侍奉权贵，让自己不能有舒心畅意的笑颜！"
165,梦李白二首·其二,杜甫 〔唐代〕,https://www.gushiwen.cn/shiwenv_12c487f7a589.aspx,"浮云终日行，游子久不至。
三夜频梦君，情亲见君意。
告归常局促，苦道来不易。
江湖多风波，舟楫恐失坠。
出门搔白首，若负平生志。
冠盖满京华，斯人独憔悴。
孰云网恢恢，将老身反累。
千秋万岁名，寂寞身后事。",遣悲怀三首·其二,孤雁二首·其二,送綦毋潜落第还乡,天上浮云终日飞来飘去，远游的故人为何久久不至。夜晚我总是频频梦到你，可知你对我的深情厚谊。分别时你总是神色匆匆，还总说相见多不容易。江湖上航行多险风恶浪，担心你的船被掀翻沉没。出门时搔着满头的白发，悔恨辜负自己平生之志。京都的官僚们冠盖相续，才华盖世的你却容颜憔悴。谁能说天理公道无欺人，迟暮之年却无辜受牵累。即使有流芳千秋的美名，难以补偿遭受的冷落悲戚。
166,梦李白二首·其一,杜甫 〔唐代〕,https://www.gushiwen.cn/shiwenv_46c874845670.aspx,"死别已吞声，生别常恻恻。
江南瘴疠地，逐客无消息。
故人入我梦，明我长相忆。
恐非平生魂，路远不可测。
魂来枫林青，魂返关塞黑。
君今在罗网，何以有羽翼？
落月满屋梁，犹疑照颜色。
水深波浪阔，无使蛟龙得。",长相思·其一,宫词二首·其一,长恨歌,为死别往往使人泣不成声，而生离却常令人更加伤悲。江南山泽是瘴疬流行之处，被贬谪的人为何毫无消息？老朋友你忽然来到我梦里，因为你知道我常把你记忆。梦中的你恐不会是鬼魂吧，路途遥远生与死实难估计。灵魂飘来是从西南青枫林，灵魂返回是由关山的黑地。你如今陷入囹圄身不由己，哪有羽翼飞来这北国之地？明月落下清辉洒满了屋梁，迷离中见到你的颜容憔悴。水深浪阔旅途请多加小心，不要失足落入蛟龙的嘴里。
167,桃花溪,张旭 〔唐代〕,https://www.gushiwen.cn/shiwenv_7415a0681d7c.aspx,"隐隐飞桥隔野烟，石矶西畔问渔船。
桃花尽日随流水，洞在清溪何处边。",寄扬州韩绰判官,桃源行,阙题,山谷云烟缭绕，溪上飞架的高桥若隐若现；站在岩石西侧询问那捕鱼归来渔人。这里桃花随着流水，终日地漂流不尽，这不就是桃花源外的桃花溪吗？你可知桃源洞口在清溪的哪边？
168,桃源行,王维 〔唐代〕,https://www.gushiwen.cn/shiwenv_231daf6badef.aspx,"渔舟逐水爱山春，两岸桃花夹古津。
坐看红树不知远，行尽青溪不见人。(不见 一作：忽值)
山口潜行始隈隩，山开旷望旋平陆。
遥看一处攒云树，近入千家散花竹。
樵客初传汉姓名，居人未改秦衣服。
居人共住武陵源，还从物外起田园。
月明松下房栊静，日出云中鸡犬喧。
惊闻俗客争来集，竞引还家问都邑。
平明闾巷扫花开，薄暮渔樵乘水入。
初因避地去人间，及至成仙遂不还。
峡里谁知有人事，世中遥望空云山。
不疑灵境难闻见，尘心未尽思乡县。
出洞无论隔山水，辞家终拟长游衍。
自谓经过旧不迷，安知峰壑今来变。
当时只记入山深，青溪几度到云林。
春来遍是桃花水，不辨仙源何处寻。",送魏万之京,桃花溪,秋登兰山寄张五,渔舟顺溪而下，追寻那美妙的春景，夹岸桃花映红了古渡口两旁。花树缤纷，忘记了路程远近；行到青溪尽处，忽然隐约似见人烟。走入了幽深曲折的山口，再往前，豁然开朗一片平川。远望去丛丛绿树有如云霞绮聚集，进村见户户门前翠竹鲜花掩映。第一次才听说汉以后的朝代，村民穿戴的还是秦代衣装。他们世代聚居在武陵源，在这里共建了世外田园。明月朗照，松下房栊寂静；旭日升起，村中鸡犬声响起。村人惊讶地把外客迎接，争相邀请，询问那世上的消息。清晨的街巷，家家打扫花径；傍晚的溪边，渔樵乘船回村。当初因避乱世逃出尘寰，寻到这桃源仙境便不归还。从此隐居峡谷，再不管外间变化；世人求访异境，不过是空望云山。渔人不怀疑这是难得的仙境，但凡心未尽只把家园挂牵；出洞后他不顾隔山隔水，又决定辞家来此仙源。自认为来过的地方不会迷路，怎知道眼前的峰壑全然改变。当时曾记得山径幽深，沿青溪几回弯曲才到桃林。此日又逢春天，依然遍地桃花水；仙源何处，已杳杳难寻，不辨道路！
