Poem_Index,Title,Author,URL,Content,A,B,C,Translation
54,送杨氏女,韦应物 〔唐代〕,https://www.gushiwen.cn/shiwenv_871dfe3a1377.aspx,"永日方戚戚，出行复悠悠。
女子今有行，大江溯轻舟。
尔辈苦无恃，抚念益慈柔。
幼为长所育，两别泣不休。
对此结中肠，义往难复留。
自小阙内训，事姑贻我忧。
赖兹托令门，任恤庶无尤。
贫俭诚所尚，资从岂待周。
孝恭遵妇道，容止顺其猷。
别离在今晨，见尔当何秋。
居闲始自遣，临感忽难收。
归来视幼女，零泪缘缨流。",喜见外弟又言别,贫女,烈女操,"我整日忧郁而悲悲戚戚，女儿就要出嫁遥远地方。
今天她要远行去做新娘，乘坐轻舟沿江逆流而上。
你姐妹自幼尝尽失母苦，念此我就加倍慈柔抚养。
妹妹从小全靠姐姐养育，今日两人作别泪泣成行。
面对此情景我内心郁结，女大当嫁你也难得再留。
你自小缺少慈母的教训，侍奉婆婆的事令我担忧。
幸好依仗你夫家好门第，信任怜恤不挑剔你过失。
安贫乐俭是我一贯崇尚，嫁妆岂能做到周全丰厚。
望你孝敬长辈遵守妇道，仪容举止都要符合规矩。
今晨我们父女就要离别，再见到你不知什么时候。
闲居时忧伤能自我排遣，临别感伤情绪一发难收。
回到家中看到孤单小女，悲哀泪水沿着帽带滚流。"
55,送杜少府之任蜀州,王勃 〔唐代〕,https://www.gushiwen.cn/shiwenv_5775c79bcd34.aspx,"城阙辅三秦，风烟望五津。
与君离别意，同是宦游人。
海内存知己，天涯若比邻。
无为在歧路，儿女共沾巾。",和晋陵陆丞早春游望,送李中丞之襄州,饯别王十一南游,三秦之地护卫着巍巍长安，透过那风云烟雾遥望着蜀川。和你离别心中怀着无限情意，因为我们同是在宦海中浮沉。四海之内有知心朋友，即使远在天边也如近在比邻。绝不要在岔路口上分手之时，像恋爱中的青年男女那样悲伤得泪湿衣巾。
56,送李少府贬峡中王少府贬长沙,高适 〔唐代〕,https://www.gushiwen.cn/shiwenv_e7f783986fc1.aspx,"嗟君此别意何如，驻马衔杯问谪居。
巫峡啼猿数行泪，衡阳归雁几封书。
青枫江上秋帆远，白帝城边古木疏。
圣代即今多雨露，暂时分手莫踌躇。",送崔九,送杜少府之任蜀州,饯别王十一南游,此次离别不知你们心绪何如，停下马来饮酒饯别询问被贬的去处。巫峡猿猴悲啼令人伤心泪下，到达衡阳后让大雁多为我捎来几封书信。秋日青枫江上孤帆远远飘去，白帝城边古木参天、枝叶扶疏。当今正逢盛世，朝廷是会普降恩泽的，我们只是暂时的分离，不要烦恼悲伤。
57,送李中丞之襄州,刘长卿 〔唐代〕,https://www.gushiwen.cn/shiwenv_b2db4922a8d6.aspx,"流落征南将，曾驱十万师。
罢归无旧业，老去恋明时。
独立三边静，轻生一剑知。
茫茫江汉上，日暮欲何之。",孤雁二首·其二,晚次鄂州,送杜少府之任蜀州,这位漂泊流离的征南老将，当年曾经指挥过十万雄师。后来他罢职回乡没有产业，到老年他还留恋贤明之时。少壮时独立功勋三边平静，为国轻生只有随身佩剑知。在茫茫的汉江上飘来荡去，日到黄昏你还想要去哪里？
58,送方外上人,刘长卿 〔唐代〕,https://www.gushiwen.cn/shiwenv_862f59a02a57.aspx,"孤云将野鹤，岂向人间住。
莫买沃洲山，时人已知处。",饯别王十一南游,送友人,黄鹤楼,孤云陪伴着野鹤，怎么能在人间居住。不要买下沃洲山，现在已经有人知道那儿了。
59,送崔九,裴迪 〔唐代〕,https://www.gushiwen.cn/shiwenv_dbbccf73624e.aspx,"归山深浅去，须尽丘壑美。
莫学武陵人，暂游桃源里。",送李少府贬峡中王少府贬长沙,送友人,问刘十九,归隐山林去到最深处，山峦沟壑要尽情地赏玩。千万别学陶渊明笔下那个武陵人，只在桃花源短暂地游了游就匆匆出去。
60,送友人,李白 〔唐代〕,https://www.gushiwen.cn/shiwenv_c348339f28fd.aspx,"青山横北郭，白水绕东城。
此地一为别，孤蓬万里征。
浮云游子意，落日故人情。
挥手自兹去，萧萧班马鸣。",饯别王十一南游,淮上喜会梁州故人,金陵图,青翠的山峦横卧在城墙的北面，波光粼粼的流水围绕着城的东边。在此地我们相互道别，你就像孤蓬那样随风飘荡，到万里之外远行去了。游子心思恰似天上浮云，夕阳余晖可比难舍友情。频频挥手作别从此离去，马儿也为惜别声声嘶鸣。
61,送别·山中相送罢,王维 〔唐代〕,https://www.gushiwen.cn/shiwenv_6368d3d62fcd.aspx,"山中相送罢，日暮掩柴扉。
春草明年绿，王孙归不归？(明年 一作：年年)",寄李儋元锡,送别·下马饮君酒,送李中丞之襄州,在深山中送走了好友，夕阳西坠把柴门关闭。待到明年春草又绿的时候，朋友啊你能不能回还？
62,送别·下马饮君酒,王维 〔唐代〕,https://www.gushiwen.cn/shiwenv_dc090c40cab3.aspx,"下马饮君酒，问君何所之？
君言不得意，归卧南山陲。
但去莫复问，白云无尽时。",终南别业,塞下曲·饮马渡秋水,将进酒,请你下马来喝一杯美酒，想问问朋友你要去往哪里？你说因为生活不得意，要回乡隐居在终南山旁。只管去吧我不会再追问，那里正有绵延不尽的白云，在天空中飘荡。
63,送元二使安西,王维 〔唐代〕,https://www.gushiwen.cn/shiwenv_12a2295aa76b.aspx,"渭城朝雨浥轻尘，客舍青青柳色新。
劝君更尽一杯酒，西出阳关无故人。",听安万善吹觱篥歌,送梓州李使君,西施咏,渭城的早晨，一场春雨沾湿了轻尘，客舍周围柳树的枝叶翠嫩一新。老朋友请你再干一杯美酒，向西出了阳关就难以遇到故旧亲人了。
64,送僧归日本,钱起 〔唐代〕,https://www.gushiwen.cn/shiwenv_dffaca77458e.aspx,"上国随缘住，来途若梦行。
浮天沧海远，去世法舟轻。
水月通禅寂，鱼龙听梵声。
惟怜一灯影，万里眼中明。",渡荆门送别,贼平后送人北归,白雪歌送武判官归京,只要有机缘，随时都可以到中国来；来中国的一路都雾霭茫茫，船只像在梦中航行。小船浮于天际，驶向遥远的边际；离开中国乘船归去，将会一路顺利。心境凝定清寂，一切都如水中月那样虚幻；海内鱼龙，也会出来听你诵经之声。最爱的是有盏照亮心田的佛灯，航行万里，眼中永远都是灿烂光明。
65,送人东游,温庭筠 〔唐代〕,https://www.gushiwen.cn/shiwenv_57cf93080fe5.aspx,"荒戍落黄叶，浩然离故关。
高风汉阳渡，初日郢门山。
江上几人在，天涯孤棹还。
何当重相见，樽酒慰离颜。",归嵩山作,贼平后送人北归,送友人,荒弃的营垒上黄叶纷纷飘落，你心怀浩气、远志告别了古塞险关。汉阳渡水急风高，郢门山朝阳之下景象万千。江东亲友有几人正望眼欲穿，等候着你的孤舟从天涯回还。什么时候我们才能再次相见，举杯畅饮以抚慰离人的愁颜。
66,近试上张水部,朱庆馀 〔唐代〕,https://www.gushiwen.cn/shiwenv_b8d00bf5329b.aspx,"洞房昨夜停红烛，待晓堂前拜舅姑。
妆罢低声问夫婿，画眉深浅入时无。",无题二首·其一,酬张少府,石鱼湖上醉歌,新婚卧室昨夜花烛彻夜通明，等待拂晓去堂前拜见公婆。装扮好后轻声询问夫君：我的眉画得浓淡可合时兴？
67,过香积寺,王维 〔唐代〕,https://www.gushiwen.cn/shiwenv_406aa95e0b46.aspx,"不知香积寺，数里入云峰。
古木无人径，深山何处钟。
泉声咽危石，日色冷青松。
薄暮空潭曲，安禅制毒龙。",题破山寺后禅院,过故人庄,听蜀僧濬弹琴,不知香积寺在哪座山中，走了数里，就进入了白云缭绕的山峰。古木参天却没有人行路径，深山里何处传来古寺鸣钟？流泉被耸立的危石所阻而发出幽咽的声音，夕阳的余晖洒落在苍翠的松林上，更显清冷。日暮时分，独自在空寂的潭边，安禅入定以治伏尘俗的毒龙。
68,过故人庄,孟浩然 〔唐代〕,https://www.gushiwen.cn/shiwenv_4a0d548bebb3.aspx,"故人具鸡黍，邀我至田家。
绿树村边合，青山郭外斜。
开轩面场圃，把酒话桑麻。
待到重阳日，还来就菊花。",寻陆鸿渐不遇,客夜与故人偶集,寄人,老朋友准备丰盛的饭菜，邀请我到他田舍做客。翠绿的树林围绕着村落，一脉青山在城郭外隐隐横斜。推开窗户面对谷场菜园，共饮美酒，闲谈农务。等到九九重阳节到来时，我还要来这里观赏菊花。
69,辋川闲居赠裴秀才迪,王维 〔唐代〕,https://www.gushiwen.cn/shiwenv_81ad764f0e24.aspx,"寒山转苍翠，秋水日潺湲。
倚杖柴门外，临风听暮蝉。
渡头馀落日，墟里上孤烟。(馀 一作：余)
复值接舆醉，狂歌五柳前。",秋登兰山寄张五,赠阙下裴舍人,积雨辋川庄作,黄昏时寒冷的山野变得更加苍翠，秋水日夜缓缓流淌。我拄着拐杖伫立在茅舍的门外，迎风细听着那暮蝉的吟唱。渡口一片寂静，只剩斜照的落日，村子里升起缕缕炊烟。又碰到狂放的裴迪喝醉了酒，在我面前唱歌。
70,轮台歌奉送封大夫出师西征,岑参 〔唐代〕,https://www.gushiwen.cn/shiwenv_9aed86610172.aspx,"轮台城头夜吹角，轮台城北旄头落。
羽书昨夜过渠黎，单于已在金山西。
戍楼西望烟尘黑，汉军屯在轮台北。
上将拥旄西出征，平明吹笛大军行。
四边伐鼓雪海涌，三军大呼阴山动。
虏塞兵气连云屯，战场白骨缠草根。
剑河风急雪片阔，沙口石冻马蹄脱。(雪片阔 一作：云片阔)
亚相勤王甘苦辛，誓将报主静边尘。
古来青史谁不见，今见功名胜古人。",行路难·其一,白雪歌送武判官归京,燕歌行·并序,轮台城头夜里吹起号角，轮台城北旄头星正降落。军书昨夜连夜送过渠黎，单于已在金山以西入侵。从哨楼向西望烟尘滚滚，汉军就屯扎在轮台北境。上将手持符节率兵西征，黎明笛声响起大军起程。战鼓四起犹如雪海浪涌，三军呐喊阴山发出共鸣。敌营阴沉杀气直冲云霄，战场上白骨还缠着草根。剑河寒风猛烈大雪鹅毛，沙口石头寒冷马蹄冻脱。亚相勤于王政甘冒辛苦，立誓报效国家平定边境。古来名垂青史屡见不鲜，如今将军功名胜过古人。
71,走马川行奉送封大夫出师西征,岑参 〔唐代〕,https://www.gushiwen.cn/shiwenv_ad4d98d510ea.aspx,"君不见走马川行雪海边，平沙莽莽黄入天。
轮台九月风夜吼，一川碎石大如斗，随风满地石乱走。
匈奴草黄马正肥，金山西见烟尘飞，汉家大将西出师。
将军金甲夜不脱，半夜军行戈相拨，风头如刀面如割。
马毛带雪汗气蒸，五花连钱旋作冰，幕中草檄砚水凝。
虏骑闻之应胆慑，料知短兵不敢接，车师西门伫献捷。(车师 一作：军师)",老将行,送元二使安西,燕歌行·并序,您难道不曾看见吗？那辽阔的走马川紧靠着雪海边缘，茫茫无边的黄沙连接云天。轮台九月整夜里狂风怒号，到处的碎石块块大如斗，狂风吹得斗大乱石满地走。这时匈奴牧草繁茂军马肥，侵入金山西面烟尘滚滚飞，汉家的大将率兵开始征西。将军身著铠甲夜里也不脱，半夜行军戈矛彼此碰撞，凛冽寒风吹到脸上如刀割。马毛挂着雪花还汗气蒸腾，五花马的身上转眼结成冰，营幕中写檄文砚墨也冻凝。敌军听到大军出征应胆惊，料他不敢与我们短兵相接，我就在车师西门等待报捷。
72,赤壁,杜牧 〔唐代〕,https://www.gushiwen.cn/shiwenv_3fb397218a1e.aspx,"折戟沉沙铁未销，自将磨洗认前朝。
东风不与周郎便，铜雀春深锁二乔。",听筝,听董大弹胡笳声兼寄语弄房给事,和乐天春词,赤壁的泥沙中，埋着一枚未锈尽的断戟。自己磨洗后发现这是当年赤壁之战的遗留之物。倘若不是东风给周瑜以方便，结局恐怕是曹操取胜，二乔被关进铜雀台了。
73,赠阙下裴舍人,钱起 〔唐代〕,https://www.gushiwen.cn/shiwenv_f210718ad962.aspx,"二月黄莺飞上林，春城紫禁晓阴阴。(黄莺 一作：黄鹂)
长乐钟声花外尽，龙池柳色雨中深。
阳和不散穷途恨，霄汉长怀捧日心。(长怀 一作：长悬)
献赋十年犹未遇，羞将白发对华簪。",奉和中书舍人贾至早朝大明宫,赠内人,送綦毋潜落第还乡,早春二月，黄鹂在宫苑飞翔歌吟；拂晓时紫禁城春浓树木阴阴。长乐宫的钟声消逝在花丛外，龙池旁的杨柳沐浴在春雨中翠色深深。暖阳不能消散穷途落魄之憾，遥望天空常常怀有捧日赤心。十年来频频献赋还知音未遇，我头发斑白愧对华贵的帽簪。
74,赠孟浩然,李白 〔唐代〕,https://www.gushiwen.cn/shiwenv_709b2d5c7ebf.aspx,"吾爱孟夫子，风流天下闻。
红颜弃轩冕，白首卧松云。
醉月频中圣，迷花不事君。
高山安可仰，徒此揖清芬。",宿王昌龄隐居,黄鹤楼送孟浩然之广陵,赠内人,我敬重孟先生的庄重潇洒，他为人高尚风流倜傥闻名天下。少年时屏弃当官不走仕途，一生闲云野鹤年老时仍在山间云中逍遥自在。明月夜常常把酒临风，饮清酒而醉，他不事君王沉醉于自然美景。高山似的品格怎么能仰望着他？只有在此向您清高的人品致敬了！
75,赠卫八处士,杜甫 〔唐代〕,https://www.gushiwen.cn/shiwenv_9670cc44eef4.aspx,"人生不相见，动如参与商。
今夕复何夕，共此灯烛光。
少壮能几时，鬓发各已苍。
访旧半为鬼，惊呼热中肠。
焉知二十载，重上君子堂。
昔别君未婚，儿女忽成行。
怡然敬父执，问我来何方。
问答乃未已，驱儿罗酒浆。(乃未已 一作：未及已；驱儿 一作：儿女)
夜雨剪春韭，新炊间黄粱。
主称会面难，一举累十觞。
十觞亦不醉，感子故意长。
明日隔山岳，世事两茫茫。",宣州谢朓楼饯别校书叔云,八阵图,望月怀远,"人生别离不能常相见，就像西方的参星和东方的商星你起我落。
今夜是什么日子如此幸运，竟然能与你挑灯共叙衷情？
青春壮健年少岁月能有多少，转瞬间你我都已经两鬓如霜。
打听昔日朋友大半都已逝去，我内心激荡不得不连声哀叹。
真没想到阔别二十年之后，还能有机会再次来登门拜访。
当年分别时你还没有结婚成家，倏忽间你的子女已成帮成行。
他们彬彬有礼笑迎父亲挚友，热情地询问我来自什么地方？
还来不及讲述完所有的往事，你就催促儿女快把酒菜摆上。
冒着夜雨剪来了新鲜的韭菜，呈上新煮的黄米饭让我品尝。
你说难得有这个机会见面，开怀畅饮一连喝干了十几杯。
喝下十几杯酒也难以让我一醉，是感受到老朋友的情谊深长。
明日分别后又相隔千山万水，茫茫的世事真令人愁绪难断。"
76,赠别二首·其二,杜牧 〔唐代〕,https://www.gushiwen.cn/shiwenv_b4fbe7244670.aspx,"多情却似总无情，唯觉尊前笑不成。(尊 一作：樽)
蜡烛有心还惜别，替人垂泪到天明。",金陵图,孤雁二首·其二,金缕衣,多情的人却像是无情人儿一样冰冷，在离别的酒宴上只觉笑不出声。蜡烛仿佛还有惜别的心意，替离别的人流泪到天明。
77,赠别二首·其一,杜牧 〔唐代〕,https://www.gushiwen.cn/shiwenv_a1cf171da994.aspx,"娉娉袅袅十三余，豆蔻梢头二月初。
春风十里扬州路，卷上珠帘总不如。",白雪歌送武判官归京,凉州词二首·其一,梦李白二首·其一,十三四岁的少女姿态袅娜，举止轻盈美好，就像二月里含苞待放，初现梢头的豆蔻花。十里扬州路的春风骀荡，珠帘翠幕中的佳人姝丽没有比得上她。
78,赠内人,张祜 〔唐代〕,https://www.gushiwen.cn/shiwenv_a6a842d363d7.aspx,"禁门宫树月痕过，媚眼惟看宿鹭窠。
斜拔玉钗灯影畔，剔开红焰救飞蛾。",月夜·今夜鄜州月,赠阙下裴舍人,佳人,月光由宫门移到树梢，媚眼只看那栖息的鹭的窝巢。站在灯影前，偏头取下玉钗，挑开灯焰救出扑火飞蛾。
79,赋得暮雨送李胄,韦应物 〔唐代〕,https://www.gushiwen.cn/shiwenv_40920344347d.aspx,"楚江微雨里，建业暮钟时。
漠漠帆来重，冥冥鸟去迟。
海门深不见，浦树远含滋。
相送情无限，沾襟比散丝。",夕次盱眙县,赋得古原草送别,长安遇冯著,楚江笼罩在蒙蒙微雨里，建业城正敲响暮时之钟。江面水汽迷蒙，被打湿的船帆显得沉重，天色昏暗鸟儿飞得迟缓。长江流入海门深远不见，江边树木饱含雨滴润滋。送别老朋友我情深无限，沾襟泪水像江面的雨丝。
80,赋得古原草送别,白居易 〔唐代〕,https://www.gushiwen.cn/shiwenv_b7820a12ebaa.aspx,"离离原上草，一岁一枯荣。
野火烧不尽，春风吹又生。
远芳侵古道，晴翠接荒城。
又送王孙去，萋萋满别情。",喜见外弟又言别,赋得暮雨送李胄,渡荆门送别,原野上长满茂盛的青草，年年岁岁枯萎了又再度繁荣。野火无法烧尽满地的野草，春风一吹，它又会再一次生长出来。远处芬芳的野草遮没了古道，阳光照耀下，明丽翠绿的草原连接着荒城。今天我又来送别老朋友，连繁茂的草儿也满怀离别之情。
81,贾生,李商隐 〔唐代〕,https://www.gushiwen.cn/shiwenv_cd908d31f388.aspx,"宣室求贤访逐臣，贾生才调更无伦。
可怜夜半虚前席，不问苍生问鬼神。",遣悲怀三首·其三,长沙过贾谊宅,和贾舍人早朝大明宫之作,汉文帝求贤在未央宫前殿召见被贬的臣子，贾谊的政治才能无人能比。可惜文帝半夜移膝靠近贾谊听讲，不问百姓生机只问起鬼神之事。
82,贼退示官吏,元结 〔唐代〕,https://www.gushiwen.cn/shiwenv_b0dc7d922c3d.aspx,"癸卯岁，西原贼入道县，焚烧杀掠，几尽而去。明年，贼又攻永破邵，不犯此州边鄙而退。岂力能制敌与？盖蒙其伤怜而已。诸使何为忍苦征敛，故作诗一篇以示官吏。
昔岁逢太平，山林二十年。
泉源在庭户，洞壑当门前。
井税有常期，日晏犹得眠。
忽然遭世变，数岁亲戎旃。
今来典斯郡，山夷又纷然。
城小贼不屠，人贫伤可怜。
是以陷邻境，此州独见全。
使臣将王命，岂不如贼焉？
今彼征敛者，迫之如火煎。(今彼 一作：今被)
谁能绝人命，以作时世贤！
思欲委符节，引竿自刺船。
将家就鱼麦，归老江湖边。",兵车行,贼平后送人北归,燕歌行·并序,"癸卯年，西原贼人攻入道州城，焚烧杀戮掠夺，几乎扫光全城才走。第二年，贼人又攻打永州并占领邵州，却不侵犯道州边境而去。难道道州官兵能有力制敌吗？不过是蒙受贼人的哀怜而巳。催缴赋税的官吏为什么还如此忍心苦苦搜括呢？因此作诗一篇给官吏们看看。
我早年遇到了太平世道，在山林中隐居了二十年。
清泉水流经过我家门口，山涧洞谷对着我家门前。
田租赋税有个固定期限，日上三竿依然安稳酣眠。
忽然间遭遇到世道突变，数年来亲自从军上前线。
如今我来治理这个郡县，又遇到蛮夷来骚扰侵犯。
县城太小蛮夷无意洗劫，他们也同情可怜贫穷百姓。
因此他们攻陷邻县境界，唯有这个道州独自保全。
奉皇命来收租税的使臣，难道还比不上盗贼慈善？
现在那横征暴敛的官吏，催赋逼税恰如火烧油煎。
谁忍心断绝人民的生路，换取时世所称赞的忠贤？
我想辞去官职丢弃符节，拿起竹篙自己动手撑船。
带领全家回到鱼米之乡，告老归隐住在那江湖边。"
83,贼平后送人北归,司空曙 〔唐代〕,https://www.gushiwen.cn/shiwenv_558c33fed0df.aspx,"世乱同南去，时清独北还。
他乡生白发，旧国见青山。
晓月过残垒，繁星宿故关。
寒禽与衰草，处处伴愁颜。",送人东游,送友人,关山月,战乱时我和你一同逃到南方，时局安定你却独自北归家园。流落他乡头上已经生出白发，战后的家乡也只能见到青山。晓行要经过许多残破的营垒，夜里只能披星露宿荒凉故关。旷野里的飞禽与枯黄的野草，将处处伴随着你的悲苦愁颜。
84,贫女,秦韬玉 〔唐代〕,https://www.gushiwen.cn/shiwenv_440bd7ab651d.aspx,"蓬门未识绮罗香，拟托良媒益自伤。
谁爱风流高格调，共怜时世俭梳妆。
敢将十指夸针巧，不把双眉斗画长。
苦恨年年压金线，为他人作嫁衣裳。",阙题,烈女操,送杨氏女,贫家的女儿不识绮罗的芳香，想托个良媒说亲更感到悲伤。谁能爱我高尚的品格和情调？却都喜欢时下正流行的俭妆。敢夸十指灵巧针线做得精美，决不天天描眉与人争短比长。深恨年年手里拿着金线刺绣，都是替富人家小姐做嫁衣裳。
85,谷口书斋寄杨补阙,钱起 〔唐代〕,https://www.gushiwen.cn/shiwenv_b9dba57bdd9b.aspx,"泉壑带茅茨，云霞生薜帷。
竹怜新雨后，山爱夕阳时。
闲鹭栖常早，秋花落更迟。
家僮扫萝径，昨与故人期。",山居秋暝,阙题,秋日登吴公台上寺远眺,山泉沟壑萦绕着这座茅屋书斋，云霞映衬墙头薜荔像五彩幔帷。雨后新竹的姿彩多么叫人喜爱，更可爱晚山映照着夕阳的余辉。悠闲的白鹭常常早早回巢栖宿，秋花饱含生机比别处落得更迟。家仆正辛勤地把萝径打扫干净，我昨天与老朋友预约会面日期。
86,谒衡岳庙遂宿岳寺题门楼,韩愈 〔唐代〕,https://www.gushiwen.cn/shiwenv_516481aac665.aspx,"五岳祭秩皆三公，四方环镇嵩当中。
火维地荒足妖怪，天假神柄专其雄。
喷云泄雾藏半腹，虽有绝顶谁能穷？
我来正逢秋雨节，阴气晦昧无清风。
潜心默祷若有应，岂非正直能感通！
须臾静扫众峰出，仰见突兀撑青空。
紫盖连延接天柱，石廪腾掷堆祝融。
森然魄动下马拜，松柏一径趋灵宫。
粉墙丹柱动光彩，鬼物图画填青红。
升阶伛偻荐脯酒，欲以菲薄明其衷。
庙令老人识神意，睢盱侦伺能鞠躬。
手持杯珓导我掷，云此最吉余难同。
窜逐蛮荒幸不死，衣食才足甘长终。
侯王将相望久绝，神纵欲福难为功。
夜投佛寺上高阁，星月掩映云曈昽。
猿鸣钟动不知曙，杲杲寒日生于东。",石鼓歌,登岳阳楼,秋日赴阙题潼关驿楼,"祭祀五岳的礼仪与祭祀三公同等隆重，五岳之中，四山环绕，唯有嵩山位居中央。
衡山地处偏远，多有妖魔鬼怪出没，上天赋予南岳神君赫赫神威，让他在此独掌雄威。
山间云雾从半山腰喷涌弥漫，一片迷茫，即便有高耸绝顶，又有谁能攀至巅峰？
我前来之时，恰逢秋雨连绵，天色阴沉晦暗，连一丝清风也无。
我在心中默默祈祷，仿佛即刻有了回应，难道不是因为人正直，才能与神明感应相通吗？
片刻之间，云雾便被清扫一空，群峰豁然显现，抬头仰望，山峰突兀耸立，直插青天。
紫盖峰绵延不绝，与天柱峰紧密相连；石廪峰起伏跌宕，衔接着祝融峰的雄姿。
山势森严险峻，令人心惊魄动，我下马跪拜后，沿着松柏掩映的小径直奔神灵宫殿。
粉墙与红柱相互映照，光彩夺目，殿内壁柱上的鬼怪图画，或青或红，色彩鲜明。
登上台阶后，我弯腰献上酒肉祭品，愿以这份微薄之物，表明自己的虔诚心意。
掌管神庙的老者深谙神意，他察言观色，连连向我躬身行礼。
他手持杯珓，教我投掷占卜之法，称此卦兆最为吉利，旁人难遇这般好运。
我遭贬谪放逐至蛮荒之地，侥幸得以存活，只要衣食无忧，便甘愿在此终老一生。
封侯拜相的欲望，我早已断绝，即便神明想要赐福于我，也难以促成其事。
当晚我投宿佛寺，居于高阁之上，星月交相辉映，山间云雾朦胧，若隐若现。
猿猴啼鸣相伴着寺院钟声，不知不觉便到了天明，东方一轮清冷朝阳，缓缓升至高空。"
